{
  "agent_id": "research-config-001",
  "task": "deep analysis of config module references",
  "phase": "analyzing",
  "last_checkpoint": "2026-05-27T13:32:15Z",
  "progress": "analyzed 8 of 12 source files",
  "current_work_order": "EXEC-001",
  "output_files": [
    "partial_findings.md"
  ],
  "error": null
}
